{"schema_name":"control-store-reinitialization-state","schema_version":"1.0.0","kernel_version":"2.0.0","operation_id":"reinitialize-00000000000000000000000000000000","snapshot_path":"D:\\workspace\\eligibility-snapshot.json","snapshot_sha256":"aaaaaaaaaaaaaaaaaaaaaaaaaaaaaaaaaaaaaaaaaaaaaaaaaaaaaaaaaaaaaaaa","coordinator_session_id":"coordinator-86","replacement_store_epoch":1,"candidate_root":"D:\\workspace\\candidate","prior_root":"D:\\workspace\\prior","state":"PREPARED","state_history":[{"state":"PREPARED","recorded_at":"2026-08-27T13:00:00+08:00"}]}
